wav_filename,wav_filesize,transcriptS:\Downloads\20151207_CGN_2_0_3\CGN_2.0.3\data/audio/wav\comp-a\vl\fv400757(094).wav,390316,en omdat we vier uur moesten wachten hebben we gratis eten gehad ik zou dan ook overal slapen
S:\Downloads\20151207_CGN_2_0_3\CGN_2.0.3\data/audio/wav\comp-a\vl\fv400779(033).wav,503916,maar dan eenentwintig maart is wel ben z'n verjaardag dus dan kunnen we misschien meteen dan afspreken of zo om iets te gaan eten
S:\Downloads\20151207_CGN_2_0_3\CGN_2.0.3\data/audio/wav\comp-a\vl\fv400793(018).wav,454508,nja maar uh uh wij stonden toch al met onze rug uh naar de sfinxen
S:\Downloads\20151207_CGN_2_0_3\CGN_2.0.3\data/audio/wav\comp-a\vl\fv400297(146).wav,331692,en een andere die zou van 't bisdom nog gecontacteerd worden
S:\Downloads\20151207_CGN_2_0_3\CGN_2.0.3\data/audio/wav\comp-a\vl\fv400736(093).wav,343020,uh lijk deze zomer ze gingen dus uh ze hadden afgesproken ze gingen gaan wandelen
S:\Downloads\20151207_CGN_2_0_3\CGN_2.0.3\data/audio/wav\comp-a\vl\fv400449(029).wav,489132,en ik zie daar dus een een duif zitten op de petunia en een andere duif zit op de op de reling van 't balkon
S:\Downloads\20151207_CGN_2_0_3\CGN_2.0.3\data/audio/wav\comp-a\vl\fv400182(005).wav,355308,'k had wat gebabbeld tijdens de middag en ik moest nog keiveel doen
S:\Downloads\20151207_CGN_2_0_3\CGN_2.0.3\data/audio/wav\comp-a\vl\fv400214(006).wav,319404,uhu 't is eigenlijk wel een schande aan 't worden h in west-vlaanderen
S:\Downloads\20151207_CGN_2_0_3\CGN_2.0.3\data/audio/wav\comp-a\vl\fv400251(018).wav,535276,hm ja en dus conclusie het zal doorgaan
S:\Downloads\20151207_CGN_2_0_3\CGN_2.0.3\data/audio/wav\comp-a\vl\fv400532(049).wav,537452,hoe moet ik het uitleggen uhm enfin in een samengesteld woord mag je de letter maar n keer gebruiken
S:\Downloads\20151207_CGN_2_0_3\CGN_2.0.3\data/audio/wav\comp-a\vl\fv400216(077).wav,346220,heb jij al iets gehoord van cactusfestival mmm cactus
S:\Downloads\20151207_CGN_2_0_3\CGN_2.0.3\data/audio/wav\comp-a\vl\fv400322(019).wav,570988,uh en het duurt vrij lang eer wij een ranking krijgen en ik vermoed dat wij ongeveer op een negende plaats van veertien ploegen staan of zo
S:\Downloads\20151207_CGN_2_0_3\CGN_2.0.3\data/audio/wav\comp-a\vl\fv400290(088).wav,573932,dat wil al wat zeggen h ja ja ja en niet willen inzien h
S:\Downloads\20151207_CGN_2_0_3\CGN_2.0.3\data/audio/wav\comp-a\vl\fv400100(031).wav,281516,och ja dat zal wel minderen zeker met den tijd
S:\Downloads\20151207_CGN_2_0_3\CGN_2.0.3\data/audio/wav\comp-a\vl\fv400396(001).wav,269548,wat je nog overhoudt want uh je hebt uh pro is is daar niets van gestolen geweest
S:\Downloads\20151207_CGN_2_0_3\CGN_2.0.3\data/audio/wav\comp-a\vl\fv400505(066).wav,277548,maar ja 'k kan 'k ik niet mmm
S:\Downloads\20151207_CGN_2_0_3\CGN_2.0.3\data/audio/wav\comp-a\vl\fv400359(032).wav,368812,je moet ook rekenen ja 't was wel de periode voor de paasvakantie dus goed dan zijn de prijzen automatisch wel iets goedkoper
S:\Downloads\20151207_CGN_2_0_3\CGN_2.0.3\data/audio/wav\comp-a\vl\fv400638(004).wav,700652,uhu ge voor een kort bezoek dus ook maar ik heb altijd gehoord van uh collega's die er geweest zijn dat het uh er zo druk was
S:\Downloads\20151207_CGN_2_0_3\CGN_2.0.3\data/audio/wav\comp-a\vl\fv400434(007).wav,259180,maar 't was in combinatie met de molen die d'rnaast ligt
S:\Downloads\20151207_CGN_2_0_3\CGN_2.0.3\data/audio/wav\comp-a\vl\fv400488(104).wav,337772,van mijn eigen hoe lang ben ik nu al gestopt ja gij zijt ook gestopt h
S:\Downloads\20151207_CGN_2_0_3\CGN_2.0.3\data/audio/wav\comp-a\vl\fv400081(194).wav,416556,da 's nogal h gij zijt precies van plan van niet meer gaan te werken
S:\Downloads\20151207_CGN_2_0_3\CGN_2.0.3\data/audio/wav\comp-a\vl\fv400365(092).wav,290156,awel drie weken plus dan nog een beetje losse dagen ge hebt nu toch al
S:\Downloads\20151207_CGN_2_0_3\CGN_2.0.3\data/audio/wav\comp-a\vl\fv400346(016).wav,363756,en d'r was ne leerling van hem bij die sedert dat hem afgestudeerd was al dieje z'n reizen al twee keren had meegemaakt
S:\Downloads\20151207_CGN_2_0_3\CGN_2.0.3\data/audio/wav\comp-a\vl\fv400519(087).wav,390444,ja ik dacht neejen 't is uh mondeling met schriftelijke voorbereiding
S:\Downloads\20151207_CGN_2_0_3\CGN_2.0.3\data/audio/wav\comp-a\vl\fv400497(018).wav,299116,en toen was mijn ma daar al dus ja mmm maar gisteren heb ik nog gemaild
S:\Downloads\20151207_CGN_2_0_3\CGN_2.0.3\data/audio/wav\comp-a\vl\fv400765(080).wav,261032,in 't begin start ik met elk om om om het anderhalf uur probeer ik te stoppen
S:\Downloads\20151207_CGN_2_0_3\CGN_2.0.3\data/audio/wav\comp-a\vl\fv400248(048).wav,315820,bezoek ne moskee en tracht daar op dezelfde manier u te gedragen lijk dat ge u hier gedraagt
S:\Downloads\20151207_CGN_2_0_3\CGN_2.0.3\data/audio/wav\comp-a\vl\fv400645(043).wav,290988,neeje allee en en ook die die allee lijk dat voorgerecht dan
S:\Downloads\20151207_CGN_2_0_3\CGN_2.0.3\data/audio/wav\comp-a\vl\fv400707(017).wav,269100,en dan moet de weten dat gaat dan over zes zeven acht zinnetjes die ze een hele week kunnen voorbereiden
S:\Downloads\20151207_CGN_2_0_3\CGN_2.0.3\data/audio/wav\comp-a\vl\fv400302(092).wav,682412,de voet kost een drie- vierduizend frank en 't mannetje op de ton kost een zes- zevenduizend dus als ge ja dat bovenste stuk al hebt
S:\Downloads\20151207_CGN_2_0_3\CGN_2.0.3\data/audio/wav\comp-a\vl\fv400268(057).wav,331820,en uh en nu van de morgen was 't uhm dat ze gisteren ziek was
S:\Downloads\20151207_CGN_2_0_3\CGN_2.0.3\data/audio/wav\comp-a\vl\fv400291(021).wav,789356,neeje pasta is gewoon 't gemakkelijkst en 't zal wel uh gemakkelijk beter zijn wat dat we bij den dirk met z'n allen gegeten hebben h
S:\Downloads\20151207_CGN_2_0_3\CGN_2.0.3\data/audio/wav\comp-a\vl\fv400188(051).wav,557868,ja ja en we kunnen zo een periode zeggen van dan tot dan als er niks voor ons dan beginnen we te werken
S:\Downloads\20151207_CGN_2_0_3\CGN_2.0.3\data/audio/wav\comp-a\vl\fv400526(006).wav,376300,uh em uh verhandelbare emissie dat is van uh die vent die komen klappen heeft bij de financieringen
S:\Downloads\20151207_CGN_2_0_3\CGN_2.0.3\data/audio/wav\comp-a\vl\fv400081(091).wav,312428,uhu uhu uhu
S:\Downloads\20151207_CGN_2_0_3\CGN_2.0.3\data/audio/wav\comp-a\vl\fv400296(033).wav,257580,'k heb het wel gezien hier bij de horlogemaker in 't dorp
S:\Downloads\20151207_CGN_2_0_3\CGN_2.0.3\data/audio/wav\comp-a\vl\fv400382(011).wav,363564,onnozelaar 'k hoop dat hem het een beetje doorheeft
S:\Downloads\20151207_CGN_2_0_3\CGN_2.0.3\data/audio/wav\comp-a\vl\fv400512(079).wav,447596,ah dan is 't goed weh en nadien zijn we dan nog op stap geweest h
S:\Downloads\20151207_CGN_2_0_3\CGN_2.0.3\data/audio/wav\comp-a\vl\fv400365(071).wav,316140,allee ja moest je vlot die teksten kunnen lezen en toch al op een eerste zicht een beetje begrijpen wat dat d'rin staat
S:\Downloads\20151207_CGN_2_0_3\CGN_2.0.3\data/audio/wav\comp-a\vl\fv400737(005).wav,394028,ze bereddert zich nog 't wordt moeilijk elken dag is iets moeilijker
S:\Downloads\20151207_CGN_2_0_3\CGN_2.0.3\data/audio/wav\comp-a\vl\fv400071(071).wav,629548,zij heeft een heel herkenbare schrijfstijl h en uhm na een tijdje ben je dat procd gewoon en en dat procd komt altijd terug
S:\Downloads\20151207_CGN_2_0_3\CGN_2.0.3\data/audio/wav\comp-a\vl\fv400737(001).wav,591020,uh voor mij is het probleem min of meer opgelost in de zin dat mijn moeder overleden is maar voor u is dat nog een zeer zeer actueel probleem h
S:\Downloads\20151207_CGN_2_0_3\CGN_2.0.3\data/audio/wav\comp-a\vl\fv400782(101).wav,422316,'t is toch weekend om dan vijf minuten eventueel
S:\Downloads\20151207_CGN_2_0_3\CGN_2.0.3\data/audio/wav\comp-a\vl\fv400192(094).wav,407532,'k was blij dat 'k mee kon gaan met els ja
S:\Downloads\20151207_CGN_2_0_3\CGN_2.0.3\data/audio/wav\comp-a\vl\fv400397(031).wav,341932,en dus ze komen op en en ze voeren eigenlijk haar al als een klein kind zo en dan rijden ze haar af
S:\Downloads\20151207_CGN_2_0_3\CGN_2.0.3\data/audio/wav\comp-a\vl\fv400097(203).wav,287148,we zouden dat na mijn stages zek allee na mijn examens zeker moeten weten h
S:\Downloads\20151207_CGN_2_0_3\CGN_2.0.3\data/audio/wav\comp-a\vl\fv400213(025).wav,459436,mmm mmm nee
S:\Downloads\20151207_CGN_2_0_3\CGN_2.0.3\data/audio/wav\comp-a\vl\fv400391(018).wav,308204,ah nee da 's een hele allee een hele geschiedenis
S:\Downloads\20151207_CGN_2_0_3\CGN_2.0.3\data/audio/wav\comp-a\vl\fv400450(024).wav,380972,dus we zitten hier alleszins nog een jaar of vijf tegen dat ik hopelijk doctoraat af heb
S:\Downloads\20151207_CGN_2_0_3\CGN_2.0.3\data/audio/wav\comp-a\vl\fv400382(065).wav,598700,nee dat past er niet in en dees is fout want dees is jodelen
S:\Downloads\20151207_CGN_2_0_3\CGN_2.0.3\data/audio/wav\comp-a\vl\fv400651(053).wav,425964,maar uh in dinge heb je altijd uhm in brugge heb je nu de zaal liberty in 't concertgebouw
S:\Downloads\20151207_CGN_2_0_3\CGN_2.0.3\data/audio/wav\comp-a\vl\fv400470(037).wav,380140,h die uh niet ideaal staat op een uh flank waar het waar de zon uh voortdurend is
S:\Downloads\20151207_CGN_2_0_3\CGN_2.0.3\data/audio/wav\comp-a\vl\fv400637(046).wav,401068,dus als dat echt voor de handelaars bedoeld is die veel in handen krijgen h
S:\Downloads\20151207_CGN_2_0_3\CGN_2.0.3\data/audio/wav\comp-a\vl\fv400269(196).wav,261996,uhm zij stelt rare vragen waarvan ik zelf niet zou
S:\Downloads\20151207_CGN_2_0_3\CGN_2.0.3\data/audio/wav\comp-a\vl\fv400498(003).wav,578412,dus 't kan bijvoorbeeld zijn dat iemand kiest om zo voor zichzelf zo veel mogelijk te winnen maar de andere kiest dat ook dan gaan ze allebei verliezen
S:\Downloads\20151207_CGN_2_0_3\CGN_2.0.3\data/audio/wav\comp-a\vl\fv400625(038).wav,318380,grote vetes altijd da 's zo'n beetje 'tzelfde vakgebied h en dan toch weer niet
S:\Downloads\20151207_CGN_2_0_3\CGN_2.0.3\data/audio/wav\comp-a\vl\fv400068(282).wav,304236,bovendien prijstechnisch zou ik wel wat voordelen hebben ten opzichte van klinkers h
S:\Downloads\20151207_CGN_2_0_3\CGN_2.0.3\data/audio/wav\comp-a\vl\fv400463(114).wav,324076,maar er was hem gezegd je mag ze meenemen maar je mag niet omkijken
S:\Downloads\20151207_CGN_2_0_3\CGN_2.0.3\data/audio/wav\comp-a\vl\fv400386(023).wav,352748,ja dat ge 't op n of ander manier zou goedmaken en dat ge d'r al over bezig waart geweest
S:\Downloads\20151207_CGN_2_0_3\CGN_2.0.3\data/audio/wav\comp-a\vl\fv400304(019).wav,286828,ze wist nog niet of ze terugging naar sabena of niet
S:\Downloads\20151207_CGN_2_0_3\CGN_2.0.3\data/audio/wav\comp-a\vl\fv400781(008).wav,261100,uhu het gaat trouwens niet echt goed met beth niet
S:\Downloads\20151207_CGN_2_0_3\CGN_2.0.3\data/audio/wav\comp-a\vl\fv400182(033).wav,277100,gij zijt te goed enfin
S:\Downloads\20151207_CGN_2_0_3\CGN_2.0.3\data/audio/wav\comp-a\vl\fv400196(134).wav,340716,ja eigenlijk heel onlogisch hoor we hadden dus een grasveld dus dat was dan twintig meter breed pakt
S:\Downloads\20151207_CGN_2_0_3\CGN_2.0.3\data/audio/wav\comp-a\vl\fv400464(042).wav,291052,wij hebben een uh filharmonie die wereldwijd uh bekend is
S:\Downloads\20151207_CGN_2_0_3\CGN_2.0.3\data/audio/wav\comp-a\vl\fv400539(066).wav,271084,ja ja ja
S:\Downloads\20151207_CGN_2_0_3\CGN_2.0.3\data/audio/wav\comp-a\vl\fv400726(015).wav,327148,ja da 's groot h en dan gewoon dat hier zo in twee doen en dan ikke ik wil de ramen
S:\Downloads\20151207_CGN_2_0_3\CGN_2.0.3\data/audio/wav\comp-a\vl\fv400099(004).wav,293484,daarstraks stond ze nog op achttien ja
S:\Downloads\20151207_CGN_2_0_3\CGN_2.0.3\data/audio/wav\comp-a\vl\fv400190(109).wav,317292,ah ja toen dat ge thuiskwam zat geert en gwen met louiske bij ons
S:\Downloads\20151207_CGN_2_0_3\CGN_2.0.3\data/audio/wav\comp-a\vl\fv400461(072).wav,463468,diejen ook dus nog uh studeert dat ge dan toch zegt allee die brengt misschien terug wat evenwicht in dat meisje
S:\Downloads\20151207_CGN_2_0_3\CGN_2.0.3\data/audio/wav\comp-a\vl\fv400795(001).wav,625516,uh morgen-uh-voormiddag dat briefje in bij gaston ketels in de brievenbus gaan steken
S:\Downloads\20151207_CGN_2_0_3\CGN_2.0.3\data/audio/wav\comp-a\vl\fv400251(017).wav,324908,en die verschillende aanloopbruggen en zo maar pff blijkbaar is daar allemaal niets voor
S:\Downloads\20151207_CGN_2_0_3\CGN_2.0.3\data/audio/wav\comp-a\vl\fv400516(003).wav,284844,en naar 't schijnt is er daar heel veel een heleboel informatie ter beschikking
S:\Downloads\20151207_CGN_2_0_3\CGN_2.0.3\data/audio/wav\comp-a\vl\fv400467(004).wav,430828,pieter aspe uh de vijfde macht met een duvel-glas en nen duvel in
S:\Downloads\20151207_CGN_2_0_3\CGN_2.0.3\data/audio/wav\comp-a\vl\fv400757(070).wav,339692,ja hoe kan ik nu de boodschappen doen als 'k mijn auto nog niet terug heb ah ja 't is ook te zien wat dat je moet meebrengen zeker
S:\Downloads\20151207_CGN_2_0_3\CGN_2.0.3\data/audio/wav\comp-a\vl\fv400770(050).wav,304172,niks jawel haar achterwerk was niet zo goed oh jawel nee dat was echt niet goed
S:\Downloads\20151207_CGN_2_0_3\CGN_2.0.3\data/audio/wav\comp-a\vl\fv400605(016).wav,277548,jongerentheater uh 't is dans en spel
S:\Downloads\20151207_CGN_2_0_3\CGN_2.0.3\data/audio/wav\comp-a\vl\fv400358(114).wav,378284,en en hij zei ook ook al omdat ge dan genoeg geld hebt om uit te geven en niet op uw geld moet kijken
S:\Downloads\20151207_CGN_2_0_3\CGN_2.0.3\data/audio/wav\comp-a\vl\fv400695(051).wav,358572,ze had 't gezien aan z'n tenen dat zijn ene teen groter was dan de andere
S:\Downloads\20151207_CGN_2_0_3\CGN_2.0.3\data/audio/wav\comp-a\vl\fv400526(060).wav,267884,mmm hebben tom en uh dieter het goed gekunnen
S:\Downloads\20151207_CGN_2_0_3\CGN_2.0.3\data/audio/wav\comp-a\vl\fv400765(029).wav,557868,en dan sta ik gewoon 's morgens om negen uur op en ik zie gewoon hoeveel bladzijden dat ik per dag moet doen om dat examen op bijvoorbeeld vier dagen te kunnen leren
S:\Downloads\20151207_CGN_2_0_3\CGN_2.0.3\data/audio/wav\comp-a\vl\fv400518(039).wav,305068,van die kinderen van raymond die zijn wel kleurling niet nee nee nee nee
S:\Downloads\20151207_CGN_2_0_3\CGN_2.0.3\data/audio/wav\comp-a\vl\fv400783(065).wav,258092,dus uh dat zijn ook domme sou souvenirs
S:\Downloads\20151207_CGN_2_0_3\CGN_2.0.3\data/audio/wav\comp-a\vl\fv400519(021).wav,264556,dus voor een een dorp binnen te treden moet je ingangsgeld betalen
S:\Downloads\20151207_CGN_2_0_3\CGN_2.0.3\data/audio/wav\comp-a\vl\fv400564(068).wav,579372,ineens gaat er een gsm af en uh ja zij gaat gewoon door h zo van en zo midden in haar zinnen zo van 't is een mooi muziekje maar 't stoort
S:\Downloads\20151207_CGN_2_0_3\CGN_2.0.3\data/audio/wav\comp-a\vl\fv400554(055).wav,412012,dus we hadden eigenlijk wel redelijk veel redenen om uhm om nen auto te om om een auto te huren
S:\Downloads\20151207_CGN_2_0_3\CGN_2.0.3\data/audio/wav\comp-a\vl\fv400248(075).wav,261356,'t is 't is goed dat er iets gebeurt maar 't moet anders gebeuren h dat uh
S:\Downloads\20151207_CGN_2_0_3\CGN_2.0.3\data/audio/wav\comp-a\vl\fv400398(028).wav,389356,tja een beetje afhankelijk van het weer ofwel wat boodschappen doen of gaan fietsen
S:\Downloads\20151207_CGN_2_0_3\CGN_2.0.3\data/audio/wav\comp-a\vl\fv400810(080).wav,289708,terwijl anderzijds ja als ik hier zit aan de computer en ik zet dat hierop
S:\Downloads\20151207_CGN_2_0_3\CGN_2.0.3\data/audio/wav\comp-a\vl\fv400073(136).wav,350444,en uhm daar gewoon over kruipen en zo ge geraakte 'm wel aan uh de overzijde
S:\Downloads\20151207_CGN_2_0_3\CGN_2.0.3\data/audio/wav\comp-a\vl\fv400066(047).wav,341228,dan kunnen we aan ons derde disketje beginnen nog twintig minuten mensen
S:\Downloads\20151207_CGN_2_0_3\CGN_2.0.3\data/audio/wav\comp-a\vl\fv400185(048).wav,304748,ja ja en wat zei marjorie juist aan telefoon
S:\Downloads\20151207_CGN_2_0_3\CGN_2.0.3\data/audio/wav\comp-a\vl\fv400317(030).wav,281324,en toen de volgende keer kwamen ze met met zo'n soort truck af
S:\Downloads\20151207_CGN_2_0_3\CGN_2.0.3\data/audio/wav\comp-a\vl\fv400503(002).wav,265900,meent dje dat nu misschien wel ja allee
S:\Downloads\20151207_CGN_2_0_3\CGN_2.0.3\data/audio/wav\comp-a\vl\fv400766(052).wav,290988,'t zal wel lukken da 's echt zo moeilijk of wat da 's echt keimoeilijk ja
S:\Downloads\20151207_CGN_2_0_3\CGN_2.0.3\data/audio/wav\comp-a\vl\fv400314(070).wav,368620,heel wat van die uh grote zaken nu gelijk dexia bijvoorbeeld h die zijn beursgenoteerd
S:\Downloads\20151207_CGN_2_0_3\CGN_2.0.3\data/audio/wav\comp-a\vl\fv400306(016).wav,350764,wij waren toen gewoon genteresseerd in dat of moesten genteresseerd zijn in dat vak
S:\Downloads\20151207_CGN_2_0_3\CGN_2.0.3\data/audio/wav\comp-a\vl\fv400611(076).wav,973612,en uh die zegt ik rij hier de in 't industriegebied in en ik maak een omcirkelende beweging en ik zet m'n auto hier een beetje verder en ik wandel te voet naar huis
S:\Downloads\20151207_CGN_2_0_3\CGN_2.0.3\data/audio/wav\comp-a\vl\fv400507(022).wav,377004,'t zal wel komen h ja want die mevrouw zei ja dat 'k dan een keer moest langsgaan bij die dochter
S:\Downloads\20151207_CGN_2_0_3\CGN_2.0.3\data/audio/wav\comp-a\vl\fv400076(144).wav,268652,bij ons in aalst heeft de scouts een heel slechte naam uhm
S:\Downloads\20151207_CGN_2_0_3\CGN_2.0.3\data/audio/wav\comp-a\vl\fv400293(106).wav,322732,ja n uh in was de huwelijksviering in het restaurant zelf
S:\Downloads\20151207_CGN_2_0_3\CGN_2.0.3\data/audio/wav\comp-a\vl\fv400605(005).wav,364396,ik denk dat dat voor aso en tso was
S:\Downloads\20151207_CGN_2_0_3\CGN_2.0.3\data/audio/wav\comp-a\vl\fv400308(072).wav,1411436,en dat is nu weer n van die typische uhm voor mijn gevoel en voor mijn kennis uh misvattingen over uh en en en en bijna 'k zou bijna zeggen kapitalistisch gendoctrineerde misvattingen
S:\Downloads\20151207_CGN_2_0_3\CGN_2.0.3\data/audio/wav\comp-a\vl\fv400788(096).wav,351852,ik steek m'n vinger op en hij stelt een heel lastige vraag en ik antwoordde ze zo
S:\Downloads\20151207_CGN_2_0_3\CGN_2.0.3\data/audio/wav\comp-a\vl\fv400752(071).wav,779052,uhm 'k zeg we gaan hier wel nog voor twee een slaapplaatsje vinden toen we heel dicht bij het podium echt lagen komt er daar plots iemand zeggen there is tonight a concert until three am
S:\Downloads\20151207_CGN_2_0_3\CGN_2.0.3\data/audio/wav\comp-a\vl\fv400696(062).wav,338540,omdat dat dus de deken de de kerk is met de deken uhu
S:\Downloads\20151207_CGN_2_0_3\CGN_2.0.3\data/audio/wav\comp-a\vl\fv400311(062).wav,401256,als dat dus het katholieke deel van vlaanderen is het katholieke en 't kapitalistische deel van vlaanderen
S:\Downloads\20151207_CGN_2_0_3\CGN_2.0.3\data/audio/wav\comp-a\vl\fv400516(045).wav,585900,om wat bij te verdienen en misschien dat we morgen gaan eten naar zijn mexicaans restaurant
S:\Downloads\20151207_CGN_2_0_3\CGN_2.0.3\data/audio/wav\comp-a\vl\fv400688(045).wav,371692,en dat valt op en sommige mensen uh hebben daar problemen mee hoorde ik in de groep die met ons mee was
S:\Downloads\20151207_CGN_2_0_3\CGN_2.0.3\data/audio/wav\comp-a\vl\fv400069(314).wav,591468,ja ja allee jong
S:\Downloads\20151207_CGN_2_0_3\CGN_2.0.3\data/audio/wav\comp-a\vl\fv400092(125).wav,427308,meteen aan dat tubeke ah qua ehbo h is dat ongelooflijk daar h
S:\Downloads\20151207_CGN_2_0_3\CGN_2.0.3\data/audio/wav\comp-a\vl\fv400248(119).wav,419692,ik denk dat er iets in zit maar moet aan gewerkt worden moet serieus aan gewerkt moet moet voorbereid w moet op op niveau zijn
S:\Downloads\20151207_CGN_2_0_3\CGN_2.0.3\data/audio/wav\comp-a\vl\fv400700(132).wav,762348,ja 't was begin september me waren dus al thuis en we hadden allebei ons onze ik mijn vest en hij ook een vest me hadden dat laten hangen in in in moorsele
S:\Downloads\20151207_CGN_2_0_3\CGN_2.0.3\data/audio/wav\comp-a\vl\fv400313(109).wav,391084,en dan vroegen we wa wat was dan de bedoeling h de mooie zaken d'rvan zegt ie die neem ik mee
S:\Downloads\20151207_CGN_2_0_3\CGN_2.0.3\data/audio/wav\comp-a\vl\fv400384(138).wav,260076,ja vast benoemd maar dat kan toch lang duren ja inderdaad
S:\Downloads\20151207_CGN_2_0_3\CGN_2.0.3\data/audio/wav\comp-a\vl\fv400072(045).wav,461100,en er was nog een derde bij van vijftien of zestien ja zoiets en die wou natuurlijk absoluut ook een piercing hebben
S:\Downloads\20151207_CGN_2_0_3\CGN_2.0.3\data/audio/wav\comp-a\vl\fv400384(079).wav,311596,eigenlijk is alles wat dat wij opnemen h zijn allemaal gesprekken waarin dat wij dingen plannen
S:\Downloads\20151207_CGN_2_0_3\CGN_2.0.3\data/audio/wav\comp-a\vl\fv400518(074).wav,477484,maar wij zaten d'r zo voornamelijk van wat moeten we doen ja bij ons ook ga je donderdag heb je weer een afspraak met dick
S:\Downloads\20151207_CGN_2_0_3\CGN_2.0.3\data/audio/wav\comp-a\vl\fv400073(202).wav,645356,wat dan het uhm het enige goei alternatief is dat je een uh opzegtermijn uh ingaan h
S:\Downloads\20151207_CGN_2_0_3\CGN_2.0.3\data/audio/wav\comp-a\vl\fv400460(022).wav,285292,en dan kan die dus gelijk haar vader die die die kan dan nen helen dag niet eten
S:\Downloads\20151207_CGN_2_0_3\CGN_2.0.3\data/audio/wav\comp-a\vl\fv400548(051).wav,332716,hoe sint-hubertus nee allemaal den blandijn
S:\Downloads\20151207_CGN_2_0_3\CGN_2.0.3\data/audio/wav\comp-a\vl\fv400610(031).wav,470764,want wij waren vorige vorige zomer nee 't is 't is een jaar langer geleden uh kristien en ik wij waren in bokrijk
S:\Downloads\20151207_CGN_2_0_3\CGN_2.0.3\data/audio/wav\comp-a\vl\fv400458(030).wav,312620,mevrouw wij hebben moeten huilen met dat gedichtje dat jij voorlas
S:\Downloads\20151207_CGN_2_0_3\CGN_2.0.3\data/audio/wav\comp-a\vl\fv400092(221).wav,425132,onze paps die zegt dat honderd keren allee als ge moet stoppen daar
S:\Downloads\20151207_CGN_2_0_3\CGN_2.0.3\data/audio/wav\comp-a\vl\fv400068(190).wav,303148,of gaat omvallen nee omvallen gaat dat niet doen
S:\Downloads\20151207_CGN_2_0_3\CGN_2.0.3\data/audio/wav\comp-a\vl\fv400460(051).wav,289772,die kregen bij mij alles nu uh die gaan naar de onthaalmoeder
S:\Downloads\20151207_CGN_2_0_3\CGN_2.0.3\data/audio/wav\comp-a\vl\fv400305(051).wav,464044,die profs op de unief op de unief waren zo slecht zo vervelend daar ging je niet naartoe
S:\Downloads\20151207_CGN_2_0_3\CGN_2.0.3\data/audio/wav\comp-a\vl\fv400617(073).wav,318188,die wou alleen maar ons ja onze nieuwsgierigheid uhm aanwakkeren
S:\Downloads\20151207_CGN_2_0_3\CGN_2.0.3\data/audio/wav\comp-a\vl\fv400098(103).wav,455340,'k weet niet 'k weet 't ook niet watte
S:\Downloads\20151207_CGN_2_0_3\CGN_2.0.3\data/audio/wav\comp-a\vl\fv400754(016).wav,305964,ja je hebt van die thaise en van die chinese en van die oost-indische en
S:\Downloads\20151207_CGN_2_0_3\CGN_2.0.3\data/audio/wav\comp-a\vl\fv400368(035).wav,313196,'k moet lijk niet v allee ja niet veel hebben maar zo 'k heb behoefte aan zo ne keer iets nieuws
S:\Downloads\20151207_CGN_2_0_3\CGN_2.0.3\data/audio/wav\comp-a\vl\fv400267(012).wav,316524,en uhm da 's een gebouw waarin dat er een advocatenbureau zit en zo
S:\Downloads\20151207_CGN_2_0_3\CGN_2.0.3\data/audio/wav\comp-a\vl\fv400458(007).wav,309292,en dat heeft op mij zo nen indruk maar zo nen indruk nagelaten
S:\Downloads\20151207_CGN_2_0_3\CGN_2.0.3\data/audio/wav\comp-a\vl\fv400230(045).wav,326636,en hij wil weten of dat hij zeker zal binnengeraken
S:\Downloads\20151207_CGN_2_0_3\CGN_2.0.3\data/audio/wav\comp-a\vl\fv400317(017).wav,364524,ja en dan kunt ge u beveiligen zoveel als ge wilt h
S:\Downloads\20151207_CGN_2_0_3\CGN_2.0.3\data/audio/wav\comp-a\vl\fv400093(175).wav,538924,achttien negentien al h achttien negentien twintig ja die is al met hogere studies en zo bezig dus
S:\Downloads\20151207_CGN_2_0_3\CGN_2.0.3\data/audio/wav\comp-a\vl\fv400309(210).wav,1283564,goed dat is in 't verleden ook gebeurd maar eigenlijk wat mij interesseert is kunst die een iets meer een een een de maatschappelijke ik grijp terug naar die realisten van de vorige eeuw een maatschappelijke dimensie hebben
S:\Downloads\20151207_CGN_2_0_3\CGN_2.0.3\data/audio/wav\comp-a\vl\fv400298(090).wav,356460,op die manier krijg je aandacht h en 't is nieuw en de mensen komen kijken h
S:\Downloads\20151207_CGN_2_0_3\CGN_2.0.3\data/audio/wav\comp-a\vl\fv400190(051).wav,420076,en de laatste maal uhm uh keken we op de de oude-kwaremont
S:\Downloads\20151207_CGN_2_0_3\CGN_2.0.3\data/audio/wav\comp-a\vl\fv400181(061).wav,341996,de maandag den dinsdag den donderdag is dat den eerste maart
S:\Downloads\20151207_CGN_2_0_3\CGN_2.0.3\data/audio/wav\comp-a\vl\fv400763(062).wav,299756,dus dus dus ja wa wat doe je dan
S:\Downloads\20151207_CGN_2_0_3\CGN_2.0.3\data/audio/wav\comp-a\vl\fv400795(017).wav,309036,nee maar ik hoop dat het nu allemaal in orde komt h want uh
S:\Downloads\20151207_CGN_2_0_3\CGN_2.0.3\data/audio/wav\comp-a\vl\fv400782(051).wav,296428,uhm dan hoeft die ook niet meer h nee maar dan is ie nog wel leuk
S:\Downloads\20151207_CGN_2_0_3\CGN_2.0.3\data/audio/wav\comp-a\vl\fv400454(035).wav,320236,ja maar 't is ook zo ik kan niet acht uur op een dag research doen
S:\Downloads\20151207_CGN_2_0_3\CGN_2.0.3\data/audio/wav\comp-a\vl\fv400231(040).wav,301356,en 't was wel tof zo ja lut en ik zijn de enigsten die roken h
S:\Downloads\20151207_CGN_2_0_3\CGN_2.0.3\data/audio/wav\comp-a\vl\fv400732(037).wav,262572,'k had tienduizend frank gek gevraagd en ik heb tienduizend frank gekregen
S:\Downloads\20151207_CGN_2_0_3\CGN_2.0.3\data/audio/wav\comp-a\vl\fv400629(096).wav,332652,ende ende dat mede brr en die hangen alles maar aan elkaar zonder enig plan
S:\Downloads\20151207_CGN_2_0_3\CGN_2.0.3\data/audio/wav\comp-a\vl\fv400679(111).wav,486380,en dan ga ik uh vooraan een beetje trachten wetenschappelijk essay uh te schrijven
S:\Downloads\20151207_CGN_2_0_3\CGN_2.0.3\data/audio/wav\comp-a\vl\fv400365(038).wav,268844,ja oftewel zit ge in 't werk oftewel ga je kindjes hebben of 't gaat niet passen voor uwe man of
