wav_filename,wav_filesize,transcriptS:\Downloads\20151207_CGN_2_0_3\CGN_2.0.3\data/audio/wav\comp-a\vl\fv400787(098).wav,325996,alles wat al opgestuurd was naar limburg werd van limburg naar lokeren gestuurd
S:\Downloads\20151207_CGN_2_0_3\CGN_2.0.3\data/audio/wav\comp-a\vl\fv400299(003).wav,341164,die is eigenlijk nog niet helemaal goed genezen want ik heb nog altijd een hese stem h
S:\Downloads\20151207_CGN_2_0_3\CGN_2.0.3\data/audio/wav\comp-a\vl\fv400442(003).wav,409064,en ik denk dat m'n omgeving dat wel merkt als ik spreek dat ik uh m'n west-vlaamse klanken niet kan verbergen
S:\Downloads\20151207_CGN_2_0_3\CGN_2.0.3\data/audio/wav\comp-a\vl\fv400786(082).wav,371180,en uh wij woonden dus in het schoolhuis en je weet dat dat waren gemeentelijke schoolhuizen
S:\Downloads\20151207_CGN_2_0_3\CGN_2.0.3\data/audio/wav\comp-a\vl\fv400306(082).wav,293612,proberen langs alle mogelijke wegen die oplossingen uh d'ruit te halen
S:\Downloads\20151207_CGN_2_0_3\CGN_2.0.3\data/audio/wav\comp-a\vl\fv400444(043).wav,738476,pff misschien ik denk ook wel dat 't essentieel is voor voor uh een wetenschappelijke opleiding zoals wiskunde dat je ten minste engels beheerst
S:\Downloads\20151207_CGN_2_0_3\CGN_2.0.3\data/audio/wav\comp-a\vl\fv400789(052).wav,349100,en ik ben heel m'n leven nooit maar geen kwartier ziek geweest
S:\Downloads\20151207_CGN_2_0_3\CGN_2.0.3\data/audio/wav\comp-a\vl\fv400297(050).wav,278316,maar jijzelf hebt dat dus ook niet meer meegemaakt als uh leerling
S:\Downloads\20151207_CGN_2_0_3\CGN_2.0.3\data/audio/wav\comp-a\vl\fv400219(111).wav,353196,maar da 's nog wel maar d'r is dus ne website van waar die allemaal opgesomd zouden staan
S:\Downloads\20151207_CGN_2_0_3\CGN_2.0.3\data/audio/wav\comp-a\vl\fv400354(003).wav,256428,ken 'k ik hem of haar goed nee goed niet
S:\Downloads\20151207_CGN_2_0_3\CGN_2.0.3\data/audio/wav\comp-a\vl\fv400188(023).wav,343532,niet veel zin vandaag nee 't zal wel komen
S:\Downloads\20151207_CGN_2_0_3\CGN_2.0.3\data/audio/wav\comp-a\vl\fv400398(102).wav,583340,want ge kunt niet zeggen ik ga dat uh recupereren hoeveel laten we zeggen duizend kilowattuur per jaar dat is vijfduizend en half per jaar
S:\Downloads\20151207_CGN_2_0_3\CGN_2.0.3\data/audio/wav\comp-a\vl\fv400255(107).wav,674796,en twee uren daarna krijgen wij bericht van de rijkswacht dat dat dus nen auto was of in ieder geval een nummerplaat die gezocht werd door de rijkswacht
S:\Downloads\20151207_CGN_2_0_3\CGN_2.0.3\data/audio/wav\comp-a\vl\fv400351(019).wav,353324,zo bij gebrek aan personeel 't schijnt hebben d'r ook 'k weet niet hoeveel zaken met kerstmis gesloten
S:\Downloads\20151207_CGN_2_0_3\CGN_2.0.3\data/audio/wav\comp-a\vl\fv400302(002).wav,369836,en die zeggen dan bijvoorbeeld van die dingen ik leg vijfduizend frank op tafel h
S:\Downloads\20151207_CGN_2_0_3\CGN_2.0.3\data/audio/wav\comp-a\vl\fv400532(014).wav,430572,en we hebben v ons voorgenomen voor degene die 't minste punten hebben en die ons 't minst interesseren om die misschien weg te doen
S:\Downloads\20151207_CGN_2_0_3\CGN_2.0.3\data/audio/wav\comp-a\vl\fv400787(097).wav,640492,vijfendertig en daarmee werd er getelefoneerd naar lokeren en ja 't is goed kom gij maar aan
S:\Downloads\20151207_CGN_2_0_3\CGN_2.0.3\data/audio/wav\comp-a\vl\fv400514(011).wav,364588,en dan zo zegt ie tegen sabrina ja maar sabrina wouter en wendy dat zijn wel licentiaten h
S:\Downloads\20151207_CGN_2_0_3\CGN_2.0.3\data/audio/wav\comp-a\vl\fv400505(069).wav,337324,ja zoals de vorige keer gewoon de mensen die ie kent opzoe opzoeken waarschijnlijk
S:\Downloads\20151207_CGN_2_0_3\CGN_2.0.3\data/audio/wav\comp-a\vl\fv400282(028).wav,353644,ja ja ja da 's handiger ja mmm
S:\Downloads\20151207_CGN_2_0_3\CGN_2.0.3\data/audio/wav\comp-a\vl\fv400609(048).wav,712428,en dan dan kijken ze soms zo en dan geef ik een paar voorbeeldjes h van dat zeg je in het dialect zo en dat zeg je toch in het nederlands ook zo en alleen moet je de klank een beetje vernederlandsen
S:\Downloads\20151207_CGN_2_0_3\CGN_2.0.3\data/audio/wav\comp-a\vl\fv400098(385).wav,257068,weet gij eigenlijk of dat stagiairs iets hebben binnengebracht voor 't krantje
S:\Downloads\20151207_CGN_2_0_3\CGN_2.0.3\data/audio/wav\comp-a\vl\fv400448(161).wav,387244,mm-hu uh en da 's iemand die helpt in de programmatie ook van uh van dranouter
S:\Downloads\20151207_CGN_2_0_3\CGN_2.0.3\data/audio/wav\comp-a\vl\fv400463(113).wav,384876,want orpheus mocht in de onderwereld eurydice die gestorven was gaan ophalen
S:\Downloads\20151207_CGN_2_0_3\CGN_2.0.3\data/audio/wav\comp-a\vl\fv400699(066).wav,337644,dus haren oudste zoon die is zeker
S:\Downloads\20151207_CGN_2_0_3\CGN_2.0.3\data/audio/wav\comp-a\vl\fv400782(021).wav,578476,dus ja 't voorbeeld is voor de groep die 't zelf die participatie zelf doet en de theorie geeft de prof
S:\Downloads\20151207_CGN_2_0_3\CGN_2.0.3\data/audio/wav\comp-a\vl\fv400769(065).wav,345580,da 's echt niet normaal en toen op bepaald moment stond ze dan buiten zo en wou ze een bericht intypen
S:\Downloads\20151207_CGN_2_0_3\CGN_2.0.3\data/audio/wav\comp-a\vl\fv400235(102).wav,306732,hier pop en rock lige rockfestival m met de molly-fans
S:\Downloads\20151207_CGN_2_0_3\CGN_2.0.3\data/audio/wav\comp-a\vl\fv400788(011).wav,331628,en dan heel de lagere school in de kasteeldreef vlakbij de parochiekerk maar al gauw
S:\Downloads\20151207_CGN_2_0_3\CGN_2.0.3\data/audio/wav\comp-a\vl\fv400787(067).wav,487660,dat waren drie paters die ook in uw de school van uw v pa hadden gezeten
S:\Downloads\20151207_CGN_2_0_3\CGN_2.0.3\data/audio/wav\comp-a\vl\fv400806(008).wav,384492,en uh echt uh ja verslaafd vanaf de eerste minuut
S:\Downloads\20151207_CGN_2_0_3\CGN_2.0.3\data/audio/wav\comp-a\vl\fv400315(010).wav,417068,uh wij komen hier alles opschrijven ja dan wordt er gereageerd natuurlijk ja maar h da 's van mij h
S:\Downloads\20151207_CGN_2_0_3\CGN_2.0.3\data/audio/wav\comp-a\vl\fv400426(026).wav,346476,tja maar allee ja
S:\Downloads\20151207_CGN_2_0_3\CGN_2.0.3\data/audio/wav\comp-a\vl\fv400800(026).wav,605612,want ik heb een paar keren geprobeerd van uh grote vissen uh te trekken als die juist in beeld kwamen
S:\Downloads\20151207_CGN_2_0_3\CGN_2.0.3\data/audio/wav\comp-a\vl\fv400697(016).wav,268716,hij is op handen gedragen en waar is die sint-niklaas
S:\Downloads\20151207_CGN_2_0_3\CGN_2.0.3\data/audio/wav\comp-a\vl\fv400620(066).wav,336044,en ze gingen op weekend en da 's de enige keer dat ik in een tent geslapen heb
S:\Downloads\20151207_CGN_2_0_3\CGN_2.0.3\data/audio/wav\comp-a\vl\fv400318(041).wav,700716,omdat uhm die die streving naar sociale rechtvaardigheid die wordt ondersteund door door een religieuze overtuiging
S:\Downloads\20151207_CGN_2_0_3\CGN_2.0.3\data/audio/wav\comp-a\vl\fv400723(061).wav,344108,maar ze kent dien baas dus den baas is de de man van ons vroeger buurmeisje
S:\Downloads\20151207_CGN_2_0_3\CGN_2.0.3\data/audio/wav\comp-a\vl\fv400640(240).wav,363180,ja dienen boom staat bij mij maar dienen boom heeft geen schade aangebracht aan mijn goed
S:\Downloads\20151207_CGN_2_0_3\CGN_2.0.3\data/audio/wav\comp-a\vl\fv400488(054).wav,279532,niks ah man ik kan dat niet rieken h ah
S:\Downloads\20151207_CGN_2_0_3\CGN_2.0.3\data/audio/wav\comp-a\vl\fv400655(027).wav,388012,en we komen terug thuis zegt ie en uh we komen aan aan 't uh aan 't appartement
S:\Downloads\20151207_CGN_2_0_3\CGN_2.0.3\data/audio/wav\comp-a\vl\fv400385(015).wav,579372,dan is 't examens mmm examens examens examens
S:\Downloads\20151207_CGN_2_0_3\CGN_2.0.3\data/audio/wav\comp-a\vl\fv400252(040).wav,333996,en de betere leerkrachten ik heb van een aantal gehoord die d'r waren ik was er niet
S:\Downloads\20151207_CGN_2_0_3\CGN_2.0.3\data/audio/wav\comp-a\vl\fv400073(149).wav,391340,en nu moet ze binnenkort waarschijnlijk weer verhuizen want in oktober uhm gaan we de boel hier hopelijk opzeggen
S:\Downloads\20151207_CGN_2_0_3\CGN_2.0.3\data/audio/wav\comp-a\vl\fv400063(306).wav,354732,daar zijn zussen voor h ja zeg toch
S:\Downloads\20151207_CGN_2_0_3\CGN_2.0.3\data/audio/wav\comp-a\vl\fv400399(039).wav,623020,ja een vriend van mij die heeft goh uh ik denk dat het uh het jaar dat we getrouwd zijn in achtenzestig een zwaar verkeersongeval gehad
S:\Downloads\20151207_CGN_2_0_3\CGN_2.0.3\data/audio/wav\comp-a\vl\fv400637(072).wav,304748,lang zal dat wel niet volhouden maar hier of daar zou dat misschien wel 'ns kunnen lukken h
S:\Downloads\20151207_CGN_2_0_3\CGN_2.0.3\data/audio/wav\comp-a\vl\fv400635(084).wav,397484,'t is nog niet zeker dat zich dat allemaal sterk gaat doorzetten maar 't is toch een tendens op dit moment zo h
S:\Downloads\20151207_CGN_2_0_3\CGN_2.0.3\data/audio/wav\comp-a\vl\fv400505(067).wav,331692,mm-hu ge moet uw kamp voorbereiden h ja
S:\Downloads\20151207_CGN_2_0_3\CGN_2.0.3\data/audio/wav\comp-a\vl\fv400800(013).wav,429036,dus dat ze enkel laat ons zeggen uh de bovenste vier vijf centimeter uh uh goed kunnen bevloeien
S:\Downloads\20151207_CGN_2_0_3\CGN_2.0.3\data/audio/wav\comp-a\vl\fv400215(122).wav,305644,met al die ho hoge piffen die uh den bak indraaien
S:\Downloads\20151207_CGN_2_0_3\CGN_2.0.3\data/audio/wav\comp-a\vl\fv400757(039).wav,350188,nee nee da 's te ver h dan ben je moe maar je kan daar azo een uitgestippelde wandeling doen in 't xxx-bos
S:\Downloads\20151207_CGN_2_0_3\CGN_2.0.3\data/audio/wav\comp-a\vl\fv400327(118).wav,339372,ja ik ken al die namen niet zuh uh bob de bouwer bijvoorbeeld is nu heel populair
S:\Downloads\20151207_CGN_2_0_3\CGN_2.0.3\data/audio/wav\comp-a\vl\fv400182(082).wav,1274092,als ge daarstraks bij ons uh van de middag aan tafel den uh den alex had uh na de na de vergadering om half twaalf had 'm zo geroepen zo van als er iemand friet wilt hebben ik ga friet halen
S:\Downloads\20151207_CGN_2_0_3\CGN_2.0.3\data/audio/wav\comp-a\vl\fv400484(064).wav,346988,en een accident nee nog nooit ja kenny moest rijden
S:\Downloads\20151207_CGN_2_0_3\CGN_2.0.3\data/audio/wav\comp-a\vl\fv400725(056).wav,285292,ne fauteuil ne fauteuil dus effenaf ja david davidse
S:\Downloads\20151207_CGN_2_0_3\CGN_2.0.3\data/audio/wav\comp-a\vl\fv400535(109).wav,445100,uh 'k denk dat ze maar rond de dertig is als ze al dertig is en dat is een franaise van uh uit lille rijsel h
S:\Downloads\20151207_CGN_2_0_3\CGN_2.0.3\data/audio/wav\comp-a\vl\fv400190(055).wav,349676,we stonden eigenlijk boven op boven op de helling op de op de op de steenweg al
S:\Downloads\20151207_CGN_2_0_3\CGN_2.0.3\data/audio/wav\comp-a\vl\fv400429(108).wav,314476,uh dus ze zegt ja ze geeft 't voorbeeld van die kerstrozen-zenslag
S:\Downloads\20151207_CGN_2_0_3\CGN_2.0.3\data/audio/wav\comp-a\vl\fv400283(005).wav,524396,ze dacht dat 't ergens een ontsteking was of zo maar ze heeft heel veel pijn in haar re uh wijsvinger en duim van haar rechterhand
S:\Downloads\20151207_CGN_2_0_3\CGN_2.0.3\data/audio/wav\comp-a\vl\fv400311(099).wav,476012,maar die ook een deel van de belgische kapitalistische politiek mee bepalen
S:\Downloads\20151207_CGN_2_0_3\CGN_2.0.3\data/audio/wav\comp-a\vl\fv400516(079).wav,422956,'k zou 't toch doen hoor dan ge zijt er dan vanaf maar ik vind dat niet erg om daaraan te werken
S:\Downloads\20151207_CGN_2_0_3\CGN_2.0.3\data/audio/wav\comp-a\vl\fv400523(102).wav,316204,en dat zal zeker wel mja allee ja 'k doe dat zelfs gewoon ter ontspanning soms
S:\Downloads\20151207_CGN_2_0_3\CGN_2.0.3\data/audio/wav\comp-a\vl\fv400297(148).wav,369964,maar d'r zijn d'r zeker een stuk of vijf die weg zijn
S:\Downloads\20151207_CGN_2_0_3\CGN_2.0.3\data/audio/wav\comp-a\vl\fv400748(049).wav,315564,toen dachten ze hij haalt toronto niet meer dus ik ga niet zeggen dat hij er in keulen niet meer bij zal zijn
S:\Downloads\20151207_CGN_2_0_3\CGN_2.0.3\data/audio/wav\comp-a\vl\fv400092(033).wav,322156,en dan tot een uur of uh acht 's avonds en dan 's anderendaags de rest
S:\Downloads\20151207_CGN_2_0_3\CGN_2.0.3\data/audio/wav\comp-a\vl\fv400186(067).wav,323820,maar als 't echt maar dertigduizend woorden is en d'r staan honderdduizend woorden in ne woordenboek
S:\Downloads\20151207_CGN_2_0_3\CGN_2.0.3\data/audio/wav\comp-a\vl\fv400793(042).wav,800940,uhu want uh toet heeft dat nog gezegd uh dat uh de achterkant volledig uh vol was
S:\Downloads\20151207_CGN_2_0_3\CGN_2.0.3\data/audio/wav\comp-a\vl\fv400363(020).wav,400364,dus ge zou echt ne helen dag verliezen dus ja allee dan hebben we 't van eerste keer afgelast omdat er maar vier mensen echt gingen meegaan
S:\Downloads\20151207_CGN_2_0_3\CGN_2.0.3\data/audio/wav\comp-a\vl\fv400087(077).wav,262892,bij mijn oma is die 'ns geweest toen ie stage deed bij tony
S:\Downloads\20151207_CGN_2_0_3\CGN_2.0.3\data/audio/wav\comp-a\vl\fv400204(113).wav,290860,en uh dan ook een stage daarbij en dat vond ze wel plezant ook om te doen en
S:\Downloads\20151207_CGN_2_0_3\CGN_2.0.3\data/audio/wav\comp-a\vl\fv400510(017).wav,284844,en dan gaan we u koken en ge moet dat doen en ge mag niet lachen
S:\Downloads\20151207_CGN_2_0_3\CGN_2.0.3\data/audio/wav\comp-a\vl\fv400092(175).wav,597228,ik zag er tegenop om te gaan skin is dat echt dan
S:\Downloads\20151207_CGN_2_0_3\CGN_2.0.3\data/audio/wav\comp-a\vl\fv400456(012).wav,290924,maar toch wel de moeite waard architectorisch uh gezien
S:\Downloads\20151207_CGN_2_0_3\CGN_2.0.3\data/audio/wav\comp-a\vl\fv400305(067).wav,468204,overeind te blijven in een storm van jeugdig protest en dat lukte dus niet in twee klassen van de vier
S:\Downloads\20151207_CGN_2_0_3\CGN_2.0.3\data/audio/wav\comp-a\vl\fv400214(115).wav,520300,da 's mooi hoor 'k zou daar toch niet willen wonen
S:\Downloads\20151207_CGN_2_0_3\CGN_2.0.3\data/audio/wav\comp-a\vl\fv400357(010).wav,355436,een bekende persoonlijkheid mm-hu en hij vraagt wie dat die graag zou willen ontmoeten
S:\Downloads\20151207_CGN_2_0_3\CGN_2.0.3\data/audio/wav\comp-a\vl\fv400367(043).wav,375148,oftewel doen we een feest zo'n beetje lijk dat we met voor meters deden zo 't hanssensfeest dat we zeggen een beetje meer op die manier dan h
S:\Downloads\20151207_CGN_2_0_3\CGN_2.0.3\data/audio/wav\comp-a\vl\fv400467(032).wav,311148,maar fnac krijgt gene voet aan grond in nederland omdat ge in nederland een vaste boekenprijs hebben
S:\Downloads\20151207_CGN_2_0_3\CGN_2.0.3\data/audio/wav\comp-a\vl\fv400181(103).wav,433580,lingerie moet 'k ik ook nog gaan halen dan zijn 'k ik zelf ook al thuis h
S:\Downloads\20151207_CGN_2_0_3\CGN_2.0.3\data/audio/wav\comp-a\vl\fv400650(060).wav,723564,uh 'k ben n boek bezig het bureau uh da 's een uhm boek dat bestaat 't is een deel van een zevendelig of achtdelige reeks
S:\Downloads\20151207_CGN_2_0_3\CGN_2.0.3\data/audio/wav\comp-a\vl\fv400188(073).wav,522860,'k ga u wat koffie geven h ja geef mij wat koffie na zo een goed diner doet dat deugd een potje koffie
S:\Downloads\20151207_CGN_2_0_3\CGN_2.0.3\data/audio/wav\comp-a\vl\fv400501(031).wav,331756,ik denk dat 'k het weet weet jij het florida
S:\Downloads\20151207_CGN_2_0_3\CGN_2.0.3\data/audio/wav\comp-a\vl\fv400062(118).wav,399980,zeg gij zijt een dikke profiteur da 's niet eerlijk
S:\Downloads\20151207_CGN_2_0_3\CGN_2.0.3\data/audio/wav\comp-a\vl\fv400635(086).wav,467756,ik kan al die die die elementen die daarin meespelen ook zo maar niet uh van mekaar aflijnen
S:\Downloads\20151207_CGN_2_0_3\CGN_2.0.3\data/audio/wav\comp-a\vl\fv400803(025).wav,384364,en hier achter mij waren was de moskee waar ik binnen geweest ben
S:\Downloads\20151207_CGN_2_0_3\CGN_2.0.3\data/audio/wav\comp-a\vl\fv400062(129).wav,376108,niet geeuwen in de micro uhm uhm
S:\Downloads\20151207_CGN_2_0_3\CGN_2.0.3\data/audio/wav\comp-a\vl\fv400751(038).wav,295468,en op een bepaald moment 't was al donker uh was heel de uhm heel de markt verlicht
S:\Downloads\20151207_CGN_2_0_3\CGN_2.0.3\data/audio/wav\comp-a\vl\fv400773(041).wav,262572,'k zeg uh mark hebt ge man nodig voor 't weekend
S:\Downloads\20151207_CGN_2_0_3\CGN_2.0.3\data/audio/wav\comp-a\vl\fv400606(001).wav,1932972,uhm ik ben bij de waarnemende directeur geweest in verband met uh een nieuwe versie van het rapport en dat soort van dingen en uh ik gaf hem dus de raad om het woord klastitularis klastitularis te vervangen door klassenleraar omdat van dale toch wel uh klastitularis als belgisch nederlands bestempelt en frank weet dat ik ben dus iemand die dat allemaal onzin vindt belgisch nederlands
S:\Downloads\20151207_CGN_2_0_3\CGN_2.0.3\data/audio/wav\comp-a\vl\fv400505(052).wav,271404,en hij heeft ook niets van oostenrijk gezegd en wel van hongarije
S:\Downloads\20151207_CGN_2_0_3\CGN_2.0.3\data/audio/wav\comp-a\vl\fv400333(018).wav,472044,en hebben zij dan de laatste jaren daar serieus aan gewerkt om daar een toch wel laat ons zeggen tamelijk modern museum te gaan oprichten
S:\Downloads\20151207_CGN_2_0_3\CGN_2.0.3\data/audio/wav\comp-a\vl\fv400699(015).wav,293548,hm 'k zeg ja kan ik u daarmee geen plezier doen maar nu dacht zij
S:\Downloads\20151207_CGN_2_0_3\CGN_2.0.3\data/audio/wav\comp-a\vl\fv400285(024).wav,316140,ja nee 't was geloof ik iets waar dat ze moest leren mee leven
S:\Downloads\20151207_CGN_2_0_3\CGN_2.0.3\data/audio/wav\comp-a\vl\fv400370(074).wav,292268,ge moogt niet zeggen dat dadde euthanasie is maar toch een bepaalde vorm
S:\Downloads\20151207_CGN_2_0_3\CGN_2.0.3\data/audio/wav\comp-a\vl\fv400616(020).wav,562604,maar is het bij jou uhm in gent stiller dan bij jou thuis dan bij je ouders of of andersom
S:\Downloads\20151207_CGN_2_0_3\CGN_2.0.3\data/audio/wav\comp-a\vl\fv400403(120).wav,285932,pauline die zegt altijd dat ze een appartement wil kopen aan de kust voor later geen appartement
S:\Downloads\20151207_CGN_2_0_3\CGN_2.0.3\data/audio/wav\comp-a\vl\fv400778(122).wav,686892,dus dacht hij dan 'k zal meteen maar alles terugvorderen ja en ik heb uhm een historische uh daad gedaan vanmiddag
S:\Downloads\20151207_CGN_2_0_3\CGN_2.0.3\data/audio/wav\comp-a\vl\fv400214(183).wav,611052,kan ook dik tegenvallen nee maar die die de vader van nele moet elken dag naar brussel
S:\Downloads\20151207_CGN_2_0_3\CGN_2.0.3\data/audio/wav\comp-a\vl\fv400185(035).wav,622572,allee ik ik binnen binnen drie weken en voor dezelfde functie wat 't voordien was uh administratie
S:\Downloads\20151207_CGN_2_0_3\CGN_2.0.3\data/audio/wav\comp-a\vl\fv400717(019).wav,553324,en om half drie vraagt ze in ene keer aan mij ik denk dat het papier op is die rol op is van de fax zegt ze tegen mij
S:\Downloads\20151207_CGN_2_0_3\CGN_2.0.3\data/audio/wav\comp-a\vl\fv400455(056).wav,541036,ja nee 't lijkt mij 't lijkt mij een uh een een leuk deel van van itali
S:\Downloads\20151207_CGN_2_0_3\CGN_2.0.3\data/audio/wav\comp-a\vl\fv400366(028).wav,390764,tja tot aan mijn pensioen zeker maar ja wanneer is dat ha ja zestig of ja vijfenzestig
S:\Downloads\20151207_CGN_2_0_3\CGN_2.0.3\data/audio/wav\comp-a\vl\fv400214(046).wav,350188,maar ja vlak aan u maar in de xxx-straat waarschijnlijk dan
S:\Downloads\20151207_CGN_2_0_3\CGN_2.0.3\data/audio/wav\comp-a\vl\fv400526(021).wav,365356,'k bedoel nee ze was gewoon en uh op 't einde w begon ze zelfs vriendelijk te worden
S:\Downloads\20151207_CGN_2_0_3\CGN_2.0.3\data/audio/wav\comp-a\vl\fv400485(159).wav,264108,maar ja da 's 't probleem de vrijdag h wat hebt gij vrijdag dan
S:\Downloads\20151207_CGN_2_0_3\CGN_2.0.3\data/audio/wav\comp-a\vl\fv400516(022).wav,369324,en hij heeft daar ook gewerkt zo echt azo een workaholic geweest in de computerbranche
S:\Downloads\20151207_CGN_2_0_3\CGN_2.0.3\data/audio/wav\comp-a\vl\fv400781(021).wav,408108,ah en uh dan heeft beth gevraagd is dat voldoende om het af te maken en dan heeft ie gezegd ja nee ja
S:\Downloads\20151207_CGN_2_0_3\CGN_2.0.3\data/audio/wav\comp-a\vl\fv400546(082).wav,311596,en waar ligt lourdes dan lourdes ligt uh niet ver van de spaanse grens
S:\Downloads\20151207_CGN_2_0_3\CGN_2.0.3\data/audio/wav\comp-a\vl\fv400215(048).wav,355820,zou nog iets voor didier zo'n projecten rijken uitbuiten uh armen uitbuiten
S:\Downloads\20151207_CGN_2_0_3\CGN_2.0.3\data/audio/wav\comp-a\vl\fv400782(080).wav,264108,anders misschien bij bij johan en katrien
S:\Downloads\20151207_CGN_2_0_3\CGN_2.0.3\data/audio/wav\comp-a\vl\fv400464(009).wav,316460,hoe moet ik het zeggen klasse door eenvoud
S:\Downloads\20151207_CGN_2_0_3\CGN_2.0.3\data/audio/wav\comp-a\vl\fv400764(062).wav,297580,en hij neemt dus dat examen af van van negen tot tien na negen in theorie uiteraard h
S:\Downloads\20151207_CGN_2_0_3\CGN_2.0.3\data/audio/wav\comp-a\vl\fv400318(056).wav,492588,uhu ja nu in onze streken gaat het daar wel meer en meer naartoe denk ik ook h
S:\Downloads\20151207_CGN_2_0_3\CGN_2.0.3\data/audio/wav\comp-a\vl\fv400254(173).wav,330860,en nu heb ik zo een ander klem maar 'k had dat ook een keer van iemand van nazareth iemand die 'k ken
S:\Downloads\20151207_CGN_2_0_3\CGN_2.0.3\data/audio/wav\comp-a\vl\fv400485(138).wav,651948,ja dat is h drinken drinken drinken maar ja da 's zo ah 't streven naar altijd in een roes te zijn h
S:\Downloads\20151207_CGN_2_0_3\CGN_2.0.3\data/audio/wav\comp-a\vl\fv400315(011).wav,620844,dien deurwaarder zegt gewoon uh ik ga veronder veronderstelling uit dat deze persoon woont op dit adres en alles wat op dit adres staat kan van hem zijn
S:\Downloads\20151207_CGN_2_0_3\CGN_2.0.3\data/audio/wav\comp-a\vl\fv400429(086).wav,345004,ah ja 'k moet dat nog ne keer vragen aan ons nele of daar gewoon ne keer naar bellen
S:\Downloads\20151207_CGN_2_0_3\CGN_2.0.3\data/audio/wav\comp-a\vl\fv400093(160).wav,273964,dat was ook wel plezant maar fuifjes hoort ge bij ons nog niet zoveel
S:\Downloads\20151207_CGN_2_0_3\CGN_2.0.3\data/audio/wav\comp-a\vl\fv400498(039).wav,306540,ja want een echte goeie regisseur heeft een visie en die visie die komt er niet in n twee drie uit
S:\Downloads\20151207_CGN_2_0_3\CGN_2.0.3\data/audio/wav\comp-a\vl\fv400699(065).wav,299756,'k ben dus naar den trouw geweest van haren oudste zoon h
S:\Downloads\20151207_CGN_2_0_3\CGN_2.0.3\data/audio/wav\comp-a\vl\fv400348(046).wav,369836,zo maar vroeger kwam dieje toch nooit niet buiten
S:\Downloads\20151207_CGN_2_0_3\CGN_2.0.3\data/audio/wav\comp-a\vl\fv400690(007).wav,331564,ja zij kunnen niet veel dus 't zal uh meest bij ons zijn
S:\Downloads\20151207_CGN_2_0_3\CGN_2.0.3\data/audio/wav\comp-a\vl\fv400095(019).wav,382764,we gaan ee op de koffie bij uh eerste tante nonneke in overmere
S:\Downloads\20151207_CGN_2_0_3\CGN_2.0.3\data/audio/wav\comp-a\vl\fv400553(011).wav,489580,ah ja 't is niet goed in de week want de week is voor hem precies onhaalbaar om om 's avonds af te spreken
S:\Downloads\20151207_CGN_2_0_3\CGN_2.0.3\data/audio/wav\comp-a\vl\fv400255(145).wav,381676,en monique zei ook dat dat was nen audi van model zegt ze en we hielden dat hier in de gaten
S:\Downloads\20151207_CGN_2_0_3\CGN_2.0.3\data/audio/wav\comp-a\vl\fv400315(014).wav,532652,maar die woonde dus nog thuis zijne domicile thuis en daar is men dan direct via advocaten en zo meer
S:\Downloads\20151207_CGN_2_0_3\CGN_2.0.3\data/audio/wav\comp-a\vl\fv400606(060).wav,654444,dan moet ik die cultuurwaardebon aanvragen met uh naam adres geboortedatum en dat lief kan binnen een maand ex-lief zijn h
S:\Downloads\20151207_CGN_2_0_3\CGN_2.0.3\data/audio/wav\comp-a\vl\fv400363(007).wav,309616,'k moet nog twee weken twee volle weken blokken voordat 'k aan de examen begin dus ja
S:\Downloads\20151207_CGN_2_0_3\CGN_2.0.3\data/audio/wav\comp-a\vl\fv400308(073).wav,397292,want moderne kunst is eigenlijk ontstaan bij goya en bij de realisten
S:\Downloads\20151207_CGN_2_0_3\CGN_2.0.3\data/audio/wav\comp-a\vl\fv400482(072).wav,296364,ja da 's donker dus da 's ook weer uh het winterkleur dan
S:\Downloads\20151207_CGN_2_0_3\CGN_2.0.3\data/audio/wav\comp-a\vl\fv400372(046).wav,288300,maar misschien is mijn plaat wel fout ja 'k weet het niet
S:\Downloads\20151207_CGN_2_0_3\CGN_2.0.3\data/audio/wav\comp-a\vl\fv400374(027).wav,285356,nee is een musical ze hebben daarstraks een stuk van op tv laten zien
S:\Downloads\20151207_CGN_2_0_3\CGN_2.0.3\data/audio/wav\comp-a\vl\fv400387(029).wav,868904,ge kunt niet heel uw blad zien op dat nu moet gij uw ogen ook draaien h
S:\Downloads\20151207_CGN_2_0_3\CGN_2.0.3\data/audio/wav\comp-a\vl\fv400485(144).wav,270700,ja maar 't is toch d'r is toch nog elken avond den drang naar
S:\Downloads\20151207_CGN_2_0_3\CGN_2.0.3\data/audio/wav\comp-a\vl\fv400382(001).wav,428012,'t is aan 't minderen ja minderen maar 't regent nog ja maar 't is al wel aan 't minderen
S:\Downloads\20151207_CGN_2_0_3\CGN_2.0.3\data/audio/wav\comp-a\vl\fv400498(050).wav,309804,mmm da 's dat dat zou wel moeilijk zijn h ja voor jou h
S:\Downloads\20151207_CGN_2_0_3\CGN_2.0.3\data/audio/wav\comp-a\vl\fv400077(037).wav,301228,maar die klassens b bevinden zich naast mekaar en en en dus eigenlijk uh
S:\Downloads\20151207_CGN_2_0_3\CGN_2.0.3\data/audio/wav\comp-a\vl\fv400091(384).wav,353324,goh was ik zo blij h dat 'k 'ns vrijdag zijn we de hele dag weg geweest
S:\Downloads\20151207_CGN_2_0_3\CGN_2.0.3\data/audio/wav\comp-a\vl\fv400518(010).wav,630956,auditie en de zaterdagavond is 't gewoon een optreden van diene vent en dan de zondagnamiddag een soort van workshop
S:\Downloads\20151207_CGN_2_0_3\CGN_2.0.3\data/audio/wav\comp-a\vl\fv400755(023).wav,266668,en we komen toe en we doen onze schorten aan en dat was klassieke muziek
S:\Downloads\20151207_CGN_2_0_3\CGN_2.0.3\data/audio/wav\comp-a\vl\fv400189(081).wav,307500,ja allee dan gaat de wel veel verschillende diensten van 't uz doen
S:\Downloads\20151207_CGN_2_0_3\CGN_2.0.3\data/audio/wav\comp-a\vl\fv400302(037).wav,399724,h in zo klein dorpje hier h op hoeveel plaatsen is niet ingebroken vorige winter h
S:\Downloads\20151207_CGN_2_0_3\CGN_2.0.3\data/audio/wav\comp-a\vl\fv400741(108).wav,303084,uh en wat dat ze dan ook excellent hebben dat zijn dat is lamsvlees h
